{
  "$schema": "artifact-ref-v1.schema.json",
  "formatVersion": 1,
  "contractStatus": "contract-preview",
  "kind": "artifact-ref",
  "id": "review-report",
  "mediaType": "application/json",
  "byteLength": 512,
  "digest": "sha256:1111111111111111111111111111111111111111111111111111111111111111",
  "producer": { "runId": "run-01", "revision": 0, "nodeId": "review", "attemptId": "attempt-01" },
  "storage": { "scheme": "artifact", "relativePath": "runs/run-01/report.json" },
  "provenance": {
    "sourceDigest": "sha256:2222222222222222222222222222222222222222222222222222222222222222",
    "policyDigest": "sha256:3333333333333333333333333333333333333333333333333333333333333333",
    "redaction": "bounded"
  }
}
